,doi,title,type,journal,date,citations,altmetric,authors,org_led,org_authors,genders,org_genders,first_gender,last_gender,female_authors,male_authors,nonbinary_authors,affiliations,countries
369,10.1038/s41586-021-04016-x,Late Quaternary dynamics of Arctic biota from ancient environmental genomics,Journal,Nature,2021-01-01,0.0,822.24,"Yucheng Wang, Mikkel Winther Pedersen, Inger Greve Alsos, Bianca De Sanctis, Fernando Racimo, Ana Prohaska, Eric Coissac, Hannah Lois Owens, Marie Kristine Føreid Merkel, Antonio Fernandez-Guerra, Alexandra Rouillard, Youri Lammers, Adriana Alberti, France Denoeud, Daniel Money, Anthony H. Ruter, Hugh McColl, Nicolaj Krog Larsen, Anna A. Cherezova, Mary E. Edwards, Grigory B. Fedorov, James Haile, Ludovic Orlando, Lasse Vinner, Thorfinn Sand Korneliussen, David W. Beilman, Anders A. Bjørk, Jialu Cao, Christoph Dockter, Julie Esdale, Galina Gusarova, Kristian K. Kjeldsen, Jan Mangerud, Jeffrey T. Rasic, Birgitte Skadhauge, John Inge Svendsen, Alexei Tikhonov, Patrick Wincker, Yingchun Xing, Yubin Zhang, Duane G. Froese, Carsten Rahbek, David Bravo Nogues, Philip B. Holden, Neil R. Edwards, Richard Durbin, David J. Meltzer, Kurt H. Kjær, Per Möller, Eske Willerslev",False,Kristian Kjellerup Kjeldsen,"male, male, female, female, male, female, male, female, female, male, female, male, female, female, male, male, male, male, female, female, male, male, male, male, male, male, male, male, male, female, female, male, male, male, female, male, male, male, male, male, male, male, male, male, male, male, male, male, male, male",male,male,male,13.0,37.0,0.0,"Universite Paul Sabatier Toulouse III, Jilin University, University of Southampton, Zoological Institute of the Russian Academy of Sciences, National Research University Higher School of Economics, Universite d' Evry Val d'Essonne, Københavns Universitet, University of Cambridge, Geologiska Institutionen, Universite Paris-Saclay, US National Park Service, Saint Petersburg State University, The Open University, University of Alaska Fairbanks, Universite Grenoble Alpes, Wellcome Sanger Institute, Colorado State University, Bjerknes Centre for Climate Research, Chinese Academy of Fishery Sciences, Carlsberg Research Center, University of Alberta, Universitetet i Bergen, Southern Methodist University, Arctic and Antarctic Research Institute, Universität Bremen, Geological Survey of Denmark and Greenland, University of Hawaiʻi at Mānoa, UiT The Arctic University of Norway","France, Sweden, China, Norway, United States, Russian Federation, Germany, Canada, United Kingdom, Denmark"
370,10.1016/j.quaint.2021.06.001,"Holocene ice margin variations of the Greenland Ice Sheet and local glaciers around Sermilik Fjord, southeast Greenland",Journal,Quaternary International,2021-01-01,0.0,2.7,"Nicolaj K. Larsen, Marie Louise Siggaard-Andersen, Anders A. Bjørk, Kristian K. Kjeldsen, Anthony Ruter, Niels J. Korsgaard, Kurt H. Kjær",False,"Kristian Kjellerup Kjeldsen, Niels Jakup Korsgaard","male, female, male, male, male, male, male","male, male",male,male,1.0,6.0,0.0,"Geological Survey of Denmark and Greenland, Københavns Universitet",Denmark
371,10.1016/j.quascirev.2020.106454,Multi-phased deglaciation of south and southeast Greenland controlled by climate and topographic setting,Journal,Quaternary Science Reviews,2020-08-15,6.0,5.2,"Laura B. Levy, Nicolaj K. Larsen, Mads F. Knudsen, David L. Egholm, Anders A. Bjørk, Kristian K. Kjeldsen, Meredith A. Kelly, Jennifer A. Howley, Jesper Olsen, Dmitry Tikhomirov, Susan R.H. Zimmerman, Kurt H. Kjær",False,Kristian Kjellerup Kjeldsen,"female, male, male, male, male, male, female, female, male, male, female, male",male,female,male,4.0,8.0,0.0,"Københavns Universitet, Lawrence Livermore National Laboratory, Aarhus Universitet, Geological Survey of Denmark and Greenland, Humboldt State University, Dartmouth College","United States, Denmark"
372,10.1016/j.quascirev.2020.106223,An updated radiocarbon-based ice margin chronology for the last deglaciation of the North American Ice Sheet Complex,Journal,Quaternary Science Reviews,2020-04-15,49.0,340.2,"April S. Dalton, Martin Margold, Chris R. Stokes, Lev Tarasov, Arthur S. Dyke, Roberta S. Adams, Serge Allard, Heather E. Arends, Nigel Atkinson, John W. Attig, Peter J. Barnett, Robert L. Barnett, Martin Batterson, Pascal Bernatchez, Harold W. Borns, Andy Breckenridge, Jason P. Briner, Etienne Brouard, Janet E. Campbell, Anders E. Carlson, John J. Clague, B. Brandon Curry, Robert André Daigneault, Hugo Dubé-Loubert, Don J. Easterbrook, David A. Franzi, Hannah G. Friedrich, Svend Funder, Michelle S. Gauthier, Angela S. Gowan, Ken L. Harris, Bernard Hétu, Tom S. Hooyer, Carrie E. Jennings, Mark D. Johnson, Alan E. Kehew, Samuel E. Kelley, Daniel Kerr, Edward L. King, Kristian K. Kjeldsen, Alan R. Knaeble, Patrick Lajeunesse, Thomas R. Lakeman, Michel Lamothe, Phillip Larson, Martin Lavoie, Henry M. Loope, Thomas V. Lowell, Barbara A. Lusardi, Lorraine Manz, Isabelle McMartin, F. Chantel Nixon, Serge Occhietti, Michael A. Parkhill, David J.W. Piper, Antonius G. Pronk, Pierre J.H. Richard, John C. Ridge, Martin Ross, Martin Roy, Allen Seaman, John Shaw, Rudolph R. Stea, James T. Teller, Woodrow B. Thompson, L. Harvey Thorleifson, Daniel J. Utting, Jean J. Veillette, Brent C. Ward, Thomas K. Weddle, Herbert E. Wright",False,Kristian Kjellerup Kjeldsen,"female, male, male, male, male, female, male, female, male, male, male, male, male, male, male, male, male, male, female, male, male, male, male, male, male, male, female, male, female, female, male, male, male, female, male, male, male, male, male, male, male, male, male, male, male, male, male, male, female, female, female, male, male, male, male, male, male, male, male, male, male, male, male, male, male, male, male, male, male, male, male",male,female,male,11.0,60.0,0.0,"Université du Québec à Montréal, Western Washington University, University of Minnesota Twin Cities, Maine Geological Survey, Durham University, University of Wisconsin-Milwaukee, Simon Fraser University, Minnesota Geological Survey, Illinois State Geological Survey, Université McGill, University of Wisconsin-Madison, North Dakota Geological Survey, University of Exeter, Manitoba Geological Survey, Norges geologiske undersekelse, State University of New York at Plattsburgh, Charles University, Government of Alberta, University at Buffalo, The State University of New York, Københavns Universitet, Laurentian University, Alberta Geological Survey, Norges Teknisk-Naturvitenskapelige Universitet, University of Waterloo, Dalhousie University, New Brunswick Department of Natural Resources, Göteborgs Universitet, University of Maine, University College Dublin, Université du Québec à Rimouski, Minnesota Department of Natural Resources, Geological Survey of Canada, Stea Surficial Geology Services, Memorial University of Newfoundland, Western Michigan University, New Brunswick Geological Survey Branch (retired), Madrone Environmental Services Ltd., Oregon State University, Indiana Geological and Water Survey, University of Cincinnati, University of Minnesota Duluth, University of Manitoba, Université Laval, University of Montreal, Ministère de l‘Energie et des Ressources naturelles du Québec, University of Wisconsin-Superior, Geological Survey of Denmark and Greenland, Tufts University","Sweden, United States, Norway, Ireland, Denmark, Canada, United Kingdom, Czech Republic"
373,10.1016/j.epsl.2018.08.059,What drives 20th century polar motion?,Journal,Earth and Planetary Science Letters,2018-11-15,18.0,345.42,"Surendra Adhikari, Lambert Caron, Bernhard Steinberger, John T. Reager, Kristian K. Kjeldsen, Ben Marzeion, Eric Larour, Erik R. Ivins",False,Kristian Kjellerup Kjeldsen,"male, male, male, male, male, male, male, male",male,male,male,0.0,8.0,0.0,"Universitetet i Oslo, Jet Propulsion Laboratory, Technical University of Denmark, Deutsches GeoForschungsZentrum (GFZ), Universität Bremen, Geological Survey of Denmark and Greenland","Norway, Denmark, Germany, United States"
374,10.1126/sciadv.aar8173,A large impact crater beneath Hiawatha Glacier in northwest Greenland,Journal,Science Advances,2018-11-14,36.0,2899.674,"Kurt H. Kjær, Nicolaj K. Larsen, Tobias Binder, Anders A. Bjørk, Olaf Eisen, Mark A. Fahnestock, Svend Funder, Adam A. Garde, Henning Haack, Veit Helm, Michael Houmark-Nielsen, Kristian K. Kjeldsen, Shfaqat A. Khan, Horst Machguth, Iain McDonald, Mathieu Morlighem, Jérémie Mouginot, John D. Paden, Tod E. Waight, Christian Weikusat, Eske Willerslev, Joseph A. MacGregor",False,Kristian Kjellerup Kjeldsen,"male, male, male, male, male, male, male, male, male, male, male, male, male, male, male, male, male, male, male, male, male, male",male,male,male,0.0,22.0,0.0,"Jet Propulsion Laboratory, Statens Naturhistoriske Museum, University of Kansas, University of California, Irvine, Alfred-Wegener-Institut Helmholtz-Zentrum für Polar- und Meeresforschung, Københavns Universitet, Technical University of Denmark, University of Cambridge, University of Zurich, University of Alaska Fairbanks, Universite Grenoble Alpes, Geologic Survey of Denmark and Greenland, Aarhus Universitet, Wellcome Sanger Institute, University of Fribourg, NASA Goddard Space Flight Center, University of Ottawa, Cardiff University, Universität Bremen, Maine Mineral and Gem Museum","France, United States, Switzerland, Germany, Canada, United Kingdom, Denmark"
375,10.1038/s41598-017-05089-3,Sea ice breakup and marine melt of a retreating tidewater outlet glacier in northeast Greenland (81°N),Journal,Scientific Reports,2017-12-01,12.0,8.6,"Jørgen Bendtsen, John Mortensen, Kunuk Lennert, Jens K. Ehn, Wieter Boone, Virginie Galindo, Yu Bin Hu, Igor A. Dmitrenko, Sergei A. Kirillov, Kristian K. Kjeldsen, Yngve Kristoffersen, David G. Barber, Søren Rysgaard",False,Kristian Kjellerup Kjeldsen,"male, male, male, male, male, female, male, male, male, male, male, male, male",male,male,male,1.0,12.0,0.0,"Greenland Institute of Natural Resources, ClimateLab, Universitetet i Bergen, University of Manitoba, University of Ottawa, Statens Naturhistoriske Museum, Aarhus Universitet","Canada, Norway, Denmark, Greenland"
376,10.1002/2017GL074954,BedMachine v3: Complete Bed Topography and Ocean Bathymetry Mapping of Greenland From Multibeam Echo Sounding Combined With Mass Conservation,Journal,Geophysical Research Letters,2017-11-16,274.0,713.754,"M. Morlighem, C. N. Williams, E. Rignot, L. An, J. E. Arndt, J. L. Bamber, G. Catania, N. Chauché, J. A. Dowdeswell, B. Dorschel, I. Fenty, K. Hogan, I. Howat, A. Hubbard, M. Jakobsson, T. M. Jordan, K. K. Kjeldsen, R. Millan, L. Mayer, J. Mouginot, B. P.Y. Noël, C. O'Cofaigh, S. Palmer, S. Rysgaard, H. Seroussi, M. J. Siegert, P. Slabon, F. Straneo, M. R. van den Broeke, W. Weinrebe, M. Wood, K. B. Zinglersen",False,Kristian Kjellerup Kjeldsen,"male, male, male, male, male, male, female, male, male, male, male, female, male, male, male, male, male, male, male, male, male, male, male, male, female, male, male, female, male, male, male, male",male,male,male,4.0,28.0,0.0,"Woods Hole Oceanographic Institution, Jet Propulsion Laboratory, University of New Hampshire Durham, Durham University, Institute for Marine and Atmospheric Research, Utrecht, Statens Naturhistoriske Museum, University of Exeter, Stockholms universitet, Byrd Polar and Climate Research Center, University of California, Irvine, Alfred-Wegener-Institut Helmholtz-Zentrum für Polar- und Meeresforschung, Imperial College London, Technical University of Denmark, Scott Polar Research Institute, Aarhus Universitet, British Antarctic Survey, Greenland Institute of Natural Resources, British Geological Survey, University of Manitoba, Jackson School of Geosciences, Aberystwyth University, University of Ottawa, University of Bristol, UiT The Arctic University of Norway","Sweden, United States, Norway, Germany, Canada, United Kingdom, Denmark, Netherlands, Greenland"
377,10.5194/essd-9-589-2017,Multibeam bathymetry and CTD measurements in two fjord systems in southeastern Greenland,Journal,Earth System Science Data,2017-08-18,6.0,3.5,"Kristian Kjellerup Kjeldsen, Reimer Wilhelm Weinrebe, Jørgen Bendtsen, Anders Anker Bjørk, Kurt Henrik Kjær",True,Kristian Kjellerup Kjeldsen,"male, male, male, male, male",male,male,male,0.0,5.0,0.0,"Jet Propulsion Laboratory, ClimateLab, University of Ottawa, Technical University of Denmark, Statens Naturhistoriske Museum, Aarhus Universitet, GEOMAR - Helmholtz-Zentrum für Ozeanforschung Kiel, University of California, Irvine","Canada, Germany, United States, Denmark"
378,10.1002/2017GL074081,Ice-dammed lake drainage in west Greenland: Drainage pattern and implications on ice flow and bedrock motion,Journal,Geophysical Research Letters,2017-07-28,5.0,2.25,"Kristian K. Kjeldsen, Shfaqat A. Khan, Anders A. Bjørk, Karina Nielsen, Jeremie Mouginot",True,Kristian Kjellerup Kjeldsen,"male, male, male, female, male",male,male,male,1.0,4.0,0.0,"Jet Propulsion Laboratory, University of Ottawa, Technical University of Denmark, Statens Naturhistoriske Museum, University of California, Irvine","Canada, United States, Denmark"
379,10.1017/jog.2016.138,Asynchronous behavior of outlet glaciers feeding Godthåbsfjord (Nuup Kangerlua) and the triggering of Narsap Sermia's retreat in SW Greenland,Journal,Journal of Glaciology,2017-04-01,34.0,11.35,"Roman J. Motyka, Ryan Cassotto, Martin Truffer, Kristian K. Kjeldsen, Dirk Van As, Niels J. Korsgaard, Mark Fahnestock, Ian Howat, Peter L. Langen, John Mortensen, Kunuk Lennert, Soren Rysgaard",False,"Kristian Kjellerup Kjeldsen, Niels Jakup Korsgaard","male, male, male, male, male, male, male, male, male, male, male, male","male, male",male,male,0.0,12.0,0.0,"Greenland Institute of Natural Resources, University of New Hampshire Durham, University of Alaska Fairbanks, Nordic Volcanological Center, University of Manitoba, Danmarks Meteorologiske Institut, University of Ottawa, Statens Naturhistoriske Museum, Aarhus Universitet, Geological Survey of Denmark and Greenland, Byrd Polar and Climate Research Center","United States, Iceland, Canada, Denmark, Greenland"
380,10.1038/nature19085,Postglacial viability and colonization in North America's ice-free corridor,Journal,Nature,2016-08-10,171.0,839.728,"Mikkel W. Pedersen, Anthony Ruter, Charles Schweger, Harvey Friebe, Richard A. Staff, Kristian K. Kjeldsen, Marie L.Z. Mendoza, Alwynne B. Beaudoin, Cynthia Zutter, Nicolaj K. Larsen, Ben A. Potter, Rasmus Nielsen, Rebecca A. Rainville, Ludovic Orlando, David J. Meltzer, Kurt H. Kjær, Eske Willerslev",False,Kristian Kjellerup Kjeldsen,"male, male, male, male, male, male, female, male, female, male, male, male, female, male, male, male, male",male,male,male,3.0,14.0,0.0,"Wellcome Trust, MacEwan University, University of Alberta, University of Alaska Fairbanks, University of Calgary, Københavns Universitet, Oxford Social Sciences Division, University of Ottawa, University of Cambridge, Statens Naturhistoriske Museum, Southern Methodist University, Aarhus Universitet, Royal Alberta Museum, University of California, Berkeley","Canada, United Kingdom, Denmark, United States"
381,10.1038/sdata.2016.32,Digital elevation model and orthophotographs of Greenland based on aerial photographs from 1978-1987,Journal,Scientific Data,2016-05-10,46.0,20.35,"Niels J. Korsgaard, Christopher Nuth, Shfaqat A. Khan, Kristian K. Kjeldsen, Anders A. Bjørk, Anders Schomacker, Kurt H. Kjær",True,"Kristian Kjellerup Kjeldsen, Niels Jakup Korsgaard","male, male, male, male, male, male, male","male, male",male,male,0.0,7.0,0.0,"Universitetet i Oslo, University of Ottawa, Technical University of Denmark, Statens Naturhistoriske Museum, UiT The Arctic University of Norway","Canada, Norway, Denmark"
382,10.1038/srep22362,Holocene ice marginal fluctuations of the Qassimiut lobe in South Greenland,Journal,Scientific Reports,2016-03-04,17.0,10.05,"Nicolaj K. Larsen, Jesper Find, Anders Kristensen, Anders A. Bjørk, Kristian K. Kjeldsen, Bent V. Odgaard, Jesper Olsen, Kurt H. Kjær",False,Kristian Kjellerup Kjeldsen,"male, male, male, male, male, male, male, male",male,male,male,0.0,8.0,0.0,"Statens Naturhistoriske Museum, Aarhus Universitet",Denmark
383,10.1088/0034-4885/78/4/046801,Greenland ice sheet mass balance: A review,Journal,Reports on Progress in Physics,2015-04-01,101.0,35.78,"Shfaqat A. Khan, Andy Aschwanden, Anders A. BjØrk, John Wahr, Kristian K. Kjeldsen, Kurt H. Kjaær",False,Kristian Kjellerup Kjeldsen,"male, male, male, male, male, male",male,male,male,0.0,6.0,0.0,"Technical University of Denmark, Statens Naturhistoriske Museum, University of Colorado Boulder, University of Alaska Fairbanks","United States, Denmark"
384,10.1130/G36476.1,The response of the southern Greenland ice sheet to the Holocene thermal maximum,Journal,Geology,2015-02-18,57.0,68.7,"Nicolaj K. Larsen, Kurt H. Kjær, Benoit Lecavalier, Anders A. Bjørk, Sune Colding, Philippe Huybrechts, Karina E. Jakobsen, Kristian K. Kjeldsen, Karen Luise Knudsen, Bent V. Odgaard, Jesper Olsen",False,Kristian Kjellerup Kjeldsen,"male, male, male, male, male, male, female, male, female, male, male",male,male,male,2.0,9.0,0.0,"Memorial University of Newfoundland, University of Ottawa, Statens Naturhistoriske Museum, Aarhus Universitet, Vrije Universiteit Brussel","Canada, Belgium, Denmark"
385,10.1016/j.quascirev.2014.07.018,A model of Greenland ice sheet deglaciation constrained by observations of relative sea level and ice extent,Journal,Quaternary Science Reviews,2014-10-15,123.0,6.05,"Benoit S. Lecavalier, Glenn A. Milne, Matthew J.R. Simpson, Leanne Wake, Philippe Huybrechts, Lev Tarasov, Kristian K. Kjeldsen, Svend Funder, Antony J. Long, Sarah Woodroffe, Arthur S. Dyke, Nicolaj K. Larsen",False,Kristian Kjellerup Kjeldsen,"male, male, male, female, male, male, male, male, male, female, male, male",male,male,male,2.0,10.0,0.0,"Memorial University of Newfoundland, Durham University, University of Ottawa, Statens Naturhistoriske Museum, Aarhus Universitet, University of Northumbria, Geological Survey of Canada, Vrije Universiteit Brussel, Norwegian Mapping Authority (Karkverket)","Norway, Belgium, Canada, United Kingdom, Denmark"
386,10.1016/j.quascirev.2013.05.027,Rapid early Holocene ice retreat in West Greenland,Journal,Quaternary Science Reviews,2014-05-15,51.0,13.144,"Nicolaj K. Larsen, Svend Funder, Kurt H. Kjær, Kristian K. Kjeldsen, Mads F. Knudsen, Henriette Linge",False,Kristian Kjellerup Kjeldsen,"male, male, male, male, male, female",male,male,female,1.0,5.0,0.0,"Universitetet i Bergen, Statens Naturhistoriske Museum, Aarhus Universitet","Norway, Denmark"
387,10.1002/2013JF003034,"Ice-dammed lake drainage cools and raises surface salinities in a tidewater outlet glacier fjord, west Greenland",Journal,Journal of Geophysical Research: Earth Surface,2014-01-01,28.0,1.0,"K. K. Kjeldsen, J. Mortensen, J. Bendtsen, D. Petersen, K. Lennert, S. Rysgaard",True,Kristian Kjellerup Kjeldsen,"male, male, male, female, male, male",male,male,male,1.0,5.0,0.0,"Asiaq - Greenland Survey Nuuk, Greenland Institute of Natural Resources, ClimateLab, University of Manitoba, Statens Naturhistoriske Museum, Aarhus Universitet","Canada, Denmark, Greenland"
388,10.1038/nclimate2161,Sustained mass loss of the northeast Greenland ice sheet triggered by regional warming,Journal,Nature Climate Change,2014-01-01,149.0,406.452,"Shfaqat A. Khan, Kurt H. Kjær, Michael Bevis, Jonathan L. Bamber, John Wahr, Kristian K. Kjeldsen, Anders A. Bjørk, Niels J. Korsgaard, Leigh A. Stearns, Michiel R. Van Den Broeke, Lin Liu, Nicolaj K. Larsen, Ioana S. Muresan",False,"Kristian Kjellerup Kjeldsen, Niels Jakup Korsgaard","male, male, male, male, male, male, male, male, female, male, female, male, female","male, male",male,female,3.0,10.0,0.0,"Institute for Marine and Atmospheric Research, Utrecht, University of Colorado Boulder, Chinese University of Hong Kong, The Ohio State University, Technical University of Denmark, Statens Naturhistoriske Museum, University of Bristol, Aarhus Universitet, University of Kansas, Stanford University","United States, Hong Kong, United Kingdom, Denmark, Netherlands"
389,10.1029/2012JB009684,Improved ice loss estimate of the northwestern Greenland ice sheet,Journal,Journal of Geophysical Research: Solid Earth,2013-02-01,22.0,,"Kristian K. Kjeldsen, Shfaqat Abbas Khan, John Wahr, Niels J. Korsgaard, Kurt H. Kjær, Anders A. Bjørk, Ruud Hurkmans, Michiel R. Van Den Broeke, Jonathan L. Bamber, Jan H. Van Angelen",True,"Kristian Kjellerup Kjeldsen, Niels Jakup Korsgaard","male, male, male, male, male, male, male, male, male, male","male, male",male,male,0.0,10.0,0.0,"Institute for Marine and Atmospheric Research, Utrecht, University of Colorado Boulder, Technical University of Denmark, Statens Naturhistoriske Museum, University of Bristol","United Kingdom, Denmark, Netherlands, United States"
390,10.1126/science.1220614,Aerial photographs reveal late-20th-century dynamic ice loss in Northwestern Greenland,Journal,Science,2012-08-03,67.0,110.274,"Kurt H. Kjær, Shfaqat A. Khan, Niels J. Korsgaard, John Wahr, Jonathan L. Bamber, Ruud Hurkmans, Michiel Van Den Broeke, Lars H. Timm, Kristian K. Kjeldsen, Anders A. Bjørk, Nicolaj K. Larsen, Lars Tyge Jørgensen, Anders Færch-Jensen, Eske Willerslev",False,"Kristian Kjellerup Kjeldsen, Niels Jakup Korsgaard","male, male, male, male, male, male, male, male, male, male, male, male, male, male","male, male",male,male,0.0,14.0,0.0,"Danish National Cadastre and Survey, Institute for Marine and Atmospheric Research, Utrecht, University of Colorado Boulder, Technical University of Denmark, Statens Naturhistoriske Museum, University of Bristol, Aarhus Universitet","United Kingdom, Denmark, Netherlands, United States"
391,10.1016/j.quascirev.2011.07.022,Restricted impact of Holocene climate variations on the southern Greenland Ice Sheet,Journal,Quaternary Science Reviews,2011-10-01,44.0,3.0,"Nicolaj K. Larsen, Kurt H. Kjær, Jesper Olsen, Svend Funder, Kristian K. Kjeldsen, Niels Nørgaard-Pedersen",False,Kristian Kjellerup Kjeldsen,"male, male, male, male, male, male",male,male,male,0.0,6.0,0.0,"Geological Survey of Denmark and Greenland, Queen's University Belfast, Statens Naturhistoriske Museum, Aarhus Universitet","United Kingdom, Denmark"
392,10.1016/B978-0-444-53447-7.00050-7,"The Greenland Ice Sheet During the Past 300,000 Years: A Review",Book Series,Developments in Quaternary Science,2011-07-11,154.0,1.0,"Svend Funder, Kristian Kjellerup Kjeldsen, Kurt Henrik Kjær, Colm O Cofaigh",False,Kristian Kjellerup Kjeldsen,"male, male, male, male",male,male,male,0.0,4.0,0.0,"Statens Naturhistoriske Museum, Durham University","United Kingdom, Denmark"
393,10.1038/s41598-019-43342-z,"Postglacial relative sea level change and glacier activity in the early and late Holocene: Wahlenbergfjorden, Nordaustlandet, Svalbard",Journal,Scientific Reports,2019-12-01,8.0,4.2,"Anders Schomacker, Wesley R. Farnsworth, Ólafur Ingólfsson, Lis Allaart, Lena Håkansson, Michael Retelle, Marie Louise Siggaard-Andersen, Niels Jákup Korsgaard, Alexandra Rouillard, Sofia E. Kjellman",False,Niels Jakup Korsgaard,"male, male, male, female, female, male, female, male, female, female",male,male,female,5.0,5.0,0.0,"The University Centre in Svalbard, Haskoli Islands, Statens Naturhistoriske Museum, Geological Survey of Denmark and Greenland, Bates College, UiT The Arctic University of Norway","Iceland, Norway, Denmark, United States"
394,10.1038/s41467-017-01155-6,Younger Dryas ice margin retreat triggered by ocean surface warming in central-eastern Baffin Bay,Journal,Nature Communications,2017-12-01,15.0,94.53,"Mimmi Oksman, Kaarina Weckström, Arto Miettinen, Stephen Juggins, Dmitry V. Divine, Rebecca Jackson, Richard Telford, Niels J. Korsgaard, Michal Kucera",True,"Niels Jakup Korsgaard, Mimmi Oksman","female, female, male, male, male, female, male, male, male","male, female",female,male,3.0,6.0,0.0,"MARUM – Zen­trum für Ma­ri­ne Um­welt­wis­sen­schaf­ten, Norsk Polarinstitutt, Universitetet i Bergen, Nordic Volcanological Center, Faculty of Humanities and Social Sciences, Geological Survey of Denmark and Greenland, Helsingin Yliopisto, UiT The Arctic University of Norway","Norway, Iceland, Finland, Germany, United Kingdom, Denmark"
395,10.1038/ngeo2934,Inland thinning on the Greenland ice sheet controlled by outlet glacier geometry,Journal,Nature Geoscience,2017-05-01,45.0,202.084,"Denis Felikson, Timothy C. Bartholomaus, Ginny A. Catania, Niels J. Korsgaard, Kurt H. Kjær, Mathieu Morlighem, Brice Noël, Michiel Van Den Broeke, Leigh A. Stearns, Emily L. Shroyer, David A. Sutherland, Jonathan D. Nash",False,Niels Jakup Korsgaard,"male, male, female, male, male, male, male, male, female, female, male, male",male,male,male,3.0,9.0,0.0,"University of Idaho, Institute for Marine and Atmospheric Research, Utrecht, Nordic Volcanological Center, Oregon State University, Jackson School of Geosciences, Statens Naturhistoriske Museum, The University of Texas at Austin, University of Oregon, University of Kansas, University of California, Irvine","Iceland, Denmark, Netherlands, United States"
396,10.1016/j.epsl.2016.06.039,"Surges of outlet glaciers from the Drangajökull ice cap, northwest Iceland",Journal,Earth and Planetary Science Letters,2016-09-15,5.0,2.0,"Skafti Brynjólfsson, Anders Schomacker, Niels J. Korsgaard, Ólafur Ingólfsson",False,Niels Jakup Korsgaard,"male, male, male, male",male,male,male,0.0,4.0,0.0,"Haskoli Islands, The University Centre in Svalbard, Nordic Volcanological Center, Statens Naturhistoriske Museum, Icelandic Institute of Natural History, UiT The Arctic University of Norway","Iceland, Norway, Denmark"
