,doi,title,type,journal,date,citations,altmetric,authors,org_led,org_authors,genders,org_genders,first_gender,last_gender,female_authors,male_authors,nonbinary_authors,affiliations,countries
103,,"Outlet glacier dynamics and bathymetry at Upernavik Isstrøm and Upernavik Isfjord, North-West Greenland",Book Series,Geological Survey of Denmark and Greenland Bulletin,2014-01-01,14.0,,"Camilla S. Andresen, Kristian K. Kjeldsen, Benjamin Harden, Niels Nørgaard-Pedersen, Kurt H. Kjær",True,"Kristian Kjellerup Kjeldsen, Camilla Snowman Andresen","female, male, male, male, male","male, female",female,male,1.0,4.0,0.0,"Woods Hole Oceanographic Institution, Geological Survey of Denmark and Greenland, Statens Naturhistoriske Museum","United States, Denmark"
104,10.1016/j.csr.2013.10.003,A 100-year long record of alkenone-derived SST changes by Southeast Greenland,Journal,Continental Shelf Research,2013-12-01,9.0,0.25,"Camilla S. Andresen, Marie Alexandrine Sicre, Fiammetta Straneo, David A. Sutherland, Torben Schmith, Mads Hvid Ribergaard, Antoon Kuijpers, Jerry M. Lloyd",True,Camilla Snowman Andresen,"female, female, female, male, male, male, male, male",female,female,male,3.0,5.0,0.0,"Woods Hole Oceanographic Institution, Durham University, Danmarks Meteorologiske Institut, CNRS Centre National de la Recherche Scientifique, University of Oregon, Geological Survey of Denmark and Greenland","France, United Kingdom, Denmark, United States"
105,10.1177/0959683612474480,Fluctuations of sediment accumulation rates in front of an Arctic delta in Greenland,Journal,Holocene,2013-06-01,7.0,,"Jørn Bjarke Torp Pedersen, Aart Kroon, Bjarne Holm Jakobsen, Sebastian H. Mernild, Thorbjørn Joest Andersen, Camilla Snowman Andresen",False,Camilla Snowman Andresen,"male, male, male, male, male, female",female,male,female,1.0,5.0,0.0,"Los Alamos National Laboratory, Orbicon, Centro de Estudios Cientificos, Københavns Universitet, Geological Survey of Denmark and Greenland","United States, Denmark, Chile"
106,10.1177/0959683612460789,Mid- to late-Holocene oceanographic variability on the Southeast Greenland shelf,Journal,Holocene,2013-02-01,34.0,0.25,"C. S. Andresen, M. J. Hansen, M. S. Seidenkrantz, A. E. Jennings, M. F. Knudsen, N. Nørgaard-Pedersen, N. K. Larsen, A. Kuijpers, C. Pearce",True,Camilla Snowman Andresen,"female, male, female, female, male, male, male, male, female",female,female,female,4.0,5.0,0.0,"Geological Survey of Denmark and Greenland, University of Colorado Boulder, Aarhus Universitet","United States, Denmark"
107,10.1038/ngeo1481,An aerial view of 80 years of climate-related glacier fluctuations in southeast Greenland,Journal,Nature Geoscience,2012-06-01,134.0,100.442,"Anders A. Bjørk, Kurt H. Kjær, Niels J. Korsgaard, Shfaqat A. Khan, Kristian K. Kjeldsen, Camilla S. Andresen, Jason E. Box, Nicolaj K. Larsen, Svend Funder",False,"Kristian Kjellerup Kjeldsen, Camilla Snowman Andresen, Niels Jakup Korsgaard, Jason E. Box","male, male, male, male, male, female, male, male, male","male, female, male, male",male,male,1.0,8.0,0.0,"The Ohio State University, Technical University of Denmark, Statens Naturhistoriske Museum, Aarhus Universitet, Geological Survey of Denmark and Greenland, Byrd Polar and Climate Research Center","United States, Denmark"
108,10.1002/jqs.1487,Do paleoclimate proxies agree? A test comparing 19 late Holocene climate and sea-ice reconstructions from Icelandic marine and lake sediments,Journal,Journal of Quaternary Science,2011-08-01,27.0,,"Yarrow Axford, Camilla S. Andresen, John T. Andrews, Simon T. Belt, Áslaug Geirsdóttir, Guillaume Massé, Gifford H. Miller, Sædís Ólafsdóttir, Lindsay L. Vare",False,Camilla Snowman Andresen,"male, female, male, male, female, male, male, female, female",female,male,female,4.0,5.0,0.0,"Laboratoire d'Océanographie et du Climat : Expérimentations et Approches Numériques, Haskoli Islands, University of Colorado Boulder, Northwestern University, University of Plymouth, Geological Survey of Denmark and Greenland","France, United States, Iceland, United Kingdom, Denmark"
109,10.1177/0959683610378877,Interaction between subsurface ocean waters and calving of the Jakobshavn Isbræ during the late Holocene,Journal,Holocene,2011-03-01,44.0,3.0,"Camilla S. Andresen, David J. McCarthy, Christian Valdemar Dylmer, Marit Solveig Seidenkrantz, Antoon Kuijpers, Jerry M. Lloyd",True,Camilla Snowman Andresen,"female, male, male, female, male, male",female,female,male,2.0,4.0,0.0,"Geological Survey of Denmark and Greenland, Aarhus Universitet, Durham University","United Kingdom, Denmark"
110,,"Bathymetry, shallow seismic profiling and sediment coring in Sermilik near Helheimgletscher, South-East Greenland",Book Series,Geological Survey of Denmark and Greenland Bulletin,2010-01-01,4.0,,"Camilla Snowman Andresen, Niels Nørgaard-Pedersen, Jorn Bo Jensen, Birger Larsen",True,Camilla Snowman Andresen,"female, male, male, male",female,female,male,1.0,3.0,0.0,Geological Survey of Denmark and Greenland,Denmark
111,10.1177/0959683608093521,Variability and seasonality of North Atlantic climate during the early Holocene: Evidence from Faroe Island lake sediments,Journal,Holocene,2008-09-01,17.0,,"Catherine A. Jessen, Mats Rundgren, Svante Björck, Camilla S. Andresen, Daniel J. Conley",False,Camilla Snowman Andresen,"female, male, male, female, male",female,female,male,2.0,3.0,0.0,Lunds Universitet,Sweden
112,10.1016/j.quascirev.2006.12.017,Early Holocene terrestrial climatic variability along a North Atlantic Island transect: palaeoceanographic implications,Journal,Quaternary Science Reviews,2007-08-01,13.0,,"Camilla S. Andresen, Svante Björck, Catherine Jessen, Mats Rundgren",True,Camilla Snowman Andresen,"female, male, female, male",female,female,male,2.0,2.0,0.0,GeoBiosphere Science Centre,Sweden
113,10.1111/j.1502-3885.2006.tb01110.x,Rapid Holocene climate changes in the North Atlantic: Evidence from lake sediments from the Faroe Islands,Journal,Boreas,2006-01-01,25.0,,"Camilla Andresen, Svante Björck, Mats Rundgren, Daniel J. Conley, Catherine Jessen",True,Camilla Snowman Andresen,"female, male, male, male, female",female,female,female,2.0,3.0,0.0,"Nationalt Center for Miljø og Energi, Lunds Universitet, Aarhus Universitet","Sweden, Denmark"
114,10.1111/j.0435-3676.2005.00250.x,S Holocene climate variability in the Denmark Strait region - A land-sea correlation of new and existing climate proxy records,Journal,"Geografiska Annaler, Series A: Physical Geography",2005-07-05,29.0,,"Camilla S. Adresen, Svante Björck",False,,"female, male",,female,male,1.0,1.0,0.0,Lunds Universitet,Sweden
115,10.1016/j.margeo.2004.11.010,Holocene climate variability at multidecadal time scales detected by sedimentological indicators in a shelf core NW off Iceland,Journal,Marine Geology,2005-02-15,37.0,,"Camilla S. Andresen, Gerard Bond, Antoon Kuijpers, Paul C. Knutz, Svante Björck",True,Camilla Snowman Andresen,"female, male, male, male, male",female,female,male,1.0,4.0,0.0,"Geological Survey of Denmark and Greenland, Lamont-Doherty Earth Observatory, Lunds Universitet, Københavns Universitet","Sweden, United States, Denmark"
116,10.1002/jqs.886,Holocene climate changes in southern Greenland: Evidence from lake sediments,Journal,Journal of Quaternary Science,2004-12-01,50.0,,"Camilla Snowman Andresen, Svante Björck, Ole Bennike, Gerard Bond",True,Camilla Snowman Andresen,"female, male, male, male",female,female,male,1.0,3.0,0.0,"Geological Survey of Denmark and Greenland, Lamont-Doherty Earth Observatory, GeoBiosphere Science Centre","Sweden, United States, Denmark"
117,10.1130/0091-7613(2002)030<0427:AMYDSC>2.0.CO;2,Anomalously mild Younger Dryas summer conditions in southern Greenland,Journal,Geology,2002-07-03,67.0,,"Svante Björck, Ole Bennike, Peter Rosén, Camilla S. Andresen, Sjoerd Bohncke, Eigil Kaas, Daniel Conley",False,Camilla Snowman Andresen,"male, male, male, female, male, male, male",female,male,male,1.0,6.0,0.0,Lunds Universitet,Sweden
118,10.1130/0091-7613(2001)029<1107:HRAOAE>2.0.CO;2,High-resolution analyses of an early Holocene climate event may imply decreased solar forcing as an important climate trigger,Journal,Geology,2001-12-01,166.0,0.5,"S. Björck, R. Muscheler, B. Kromer, C. S. Andresen, J. Heinemeier, S. J. Johnsen, D. Conley, N. Koç, M. Spurk, S. Veski",False,Camilla Snowman Andresen,"male, male, male, female, male, male, male, male, male, male",female,male,male,1.0,9.0,0.0,Lunds Universitet,Sweden
119,10.1002/(SICI)1099-1417(200003)15:3<203::AID-JQS514>3.0.CO;2-8,What do Δ<sup>14</sup>C changes across the Gerzensee oscillation/GI-1b event imply for deglacial oscillations?,Journal,Journal of Quaternary Science,2000-03-01,28.0,,"C. S.A. Andresen, S. Björck, O. Bennike, J. Heinemeier, B. Kromer",True,Camilla Snowman Andresen,"female, male, male, male, male",female,female,male,1.0,4.0,0.0,"Københavns Universitet, Aarhus Universitet, Heidelberger Akademie der Wissenschaften","Denmark, Germany"
120,10.1038/s41467-021-24040-9,Storage and export of microbial biomass across the western Greenland Ice Sheet,Journal,Nature Communications,2021-12-01,0.0,24.05,"T. D.L. Irvine-Fynn, A. Edwards, I. T. Stevens, A. C. Mitchell, P. Bunting, J. E. Box, K. A. Cameron, J. M. Cook, K. Naegeli, S. M.E. Rassner, J. C. Ryan, M. Stibal, C. J. Williamson, A. Hubbard",False,Jason E. Box,"male, male, male, male, male, male, female, male, female, male, male, male, male, male",male,male,male,2.0,12.0,0.0,"University of Glasgow, The University of Sheffield, University of Bern, Aberystwyth University, Faculty of Humanities and Social Sciences, Institute of Biological, Environmental and Rural Sciences, University of Oulu, University of Bristol, Aarhus Universitet, Geological Survey of Denmark and Greenland, Brown University, Charles University, UiT The Arctic University of Norway","United States, Norway, Switzerland, Finland, Denmark, United Kingdom, Czech Republic"
121,10.1038/s41467-021-23739-z,A first constraint on basal melt-water production of the Greenland ice sheet,Journal,Nature Communications,2021-12-01,1.0,63.85,"Nanna B. Karlsson, Anne M. Solgaard, Kenneth D. Mankoff, Fabien Gillet-Chaulet, Joseph A. MacGregor, Jason E. Box, Michele Citterio, William T. Colgan, Signe H. Larsen, Kristian K. Kjeldsen, Niels J. Korsgaard, Douglas I. Benn, Ian J. Hewitt, Robert S. Fausto",True,"William Colgan, Signe Hillerup Larsen, Robert Schjøtt Fausto, Nanna Bjørnholt Karlsson, Niels Jakup Korsgaard, Kenneth David Mankoff, Anne Munck Solgaard, Kristian Kjellerup Kjeldsen, Jason E. Box, Michele Citterio","female, female, male, male, male, male, male, male, female, male, male, male, male, male","male, female, male, female, male, male, female, male, male, male",female,male,3.0,11.0,0.0,"NASA Goddard Space Flight Center, University of St Andrews, Universite Grenoble Alpes, Geological Survey of Denmark and Greenland, University of Oxford","France, United Kingdom, Denmark, United States"
122,10.1029/2021GL092942,Rainfall on the Greenland Ice Sheet: Present-Day Climatology From a High-Resolution Non-Hydrostatic Polar Regional Climate Model,Journal,Geophysical Research Letters,2021-08-16,0.0,97.63,"M. Niwano, J. E. Box, A. Wehrlé, B. Vandecrux, W. T. Colgan, J. Cappelen",False,"Baptiste Vandecrux, William Colgan, Jason E. Box","male, male, male, male, male, male","male, male, male",male,male,0.0,6.0,0.0,"Geological Survey of Denmark and Greenland, National Institute of Polar Research, Danmarks Meteorologiske Institut, Meteorological Research Institute","Japan, Denmark"
123,10.1177/03091333211011368,"Steffen K, Abdalati W and Stroeve J (1993) Climate sensitivity studies of the Greenland ice sheet using satellite AVHRR, SMMR SSM/I and in situ data. Meteorology and Atmospheric Physics 51(3–4): 239–258. DOI:10.1007/bf01030497",Journal,Progress in Physical Geography,2021-08-01,0.0,0.25,"Jason E. Box, Julienne C. Stroeve, Waleed Abdalati",True,Jason E. Box,"male, female, male",male,male,male,1.0,2.0,0.0,"Geological Survey of Denmark and Greenland, University of Manitoba, University of Colorado Boulder, Cooperative Institute for Research in Environmental Sciences","Canada, United States, Denmark"
124,10.34194/GEUSB.V47.5284,Greenland bare-ice albedo from promice automatic weather station measurements and sentinel-3 satellite observations,Book Series,GEUS Bulletin,2021-01-01,0.0,,"Adrien Wehrlé, Jason E. Box, Masashi Niwano, Alexandre M. Anesio, Robert S. Fausto",False,"Robert Schjøtt Fausto, Jason E. Box","male, male, male, male, male","male, male",male,male,0.0,5.0,0.0,"Geological Survey of Denmark and Greenland, Meteorological Research Institute, Aarhus Universitet","Japan, Denmark"
125,10.1002/qj.3901,"WMO evaluation of northern hemispheric coldest temperature: −69.6 °C at Klinck, Greenland, 22 December 1991",Journal,Quarterly Journal of the Royal Meteorological Society,2021-01-01,0.0,324.28,"George Weidner, John King, Jason E. Box, Steve Colwell, Phil Jones, Matthew Lazzara, John Cappelen, Manola Brunet, Randall S. Cerveny",False,Jason E. Box,"male, male, male, male, male, male, male, female, male",male,male,male,1.0,8.0,0.0,"Arizona State University, University of East Anglia, Madison Area Technical College, Danmarks Meteorologiske Institut, Universitat Rovira i Virgili, University of Wisconsin-Madison, Geological Survey of Denmark and Greenland, British Antarctic Survey","United States, Denmark, Spain, United Kingdom"
126,10.1038/s41467-020-19580-5,Centennial response of Greenland’s three largest outlet glaciers,Journal,Nature Communications,2020-12-01,5.0,552.54,"Shfaqat A. Khan, Anders A. Bjørk, Jonathan L. Bamber, Mathieu Morlighem, Michael Bevis, Kurt H. Kjær, Jérémie Mouginot, Anja Løkkegaard, David M. Holland, Andy Aschwanden, Bao Zhang, Veit Helm, Niels J. Korsgaard, William Colgan, Nicolaj K. Larsen, Lin Liu, Karina Hansen, Valentina Barletta, Trine S. Dahl-Jensen, Anne Sofie Søndergaard, Beata M. Csatho, Ingo Sasgen, Jason Box, Toni Schenk",False,"William Colgan, Niels Jakup Korsgaard, Anja Løkkegaard, Jason E. Box","male, male, male, male, male, male, male, female, male, male, male, male, male, male, male, female, female, female, female, female, female, male, male, male","male, male, female, male",male,male,7.0,17.0,0.0,"University of Alaska Fairbanks, NYU Abu Dhabi, University at Buffalo, The State University of New York, Alfred-Wegener-Institut Helmholtz-Zentrum für Polar- und Meeresforschung, Københavns Universitet, Chinese University of Hong Kong, The Ohio State University, Technical University of Denmark, Universite Grenoble Alpes, University of Bristol, Aarhus Universitet, Geological Survey of Denmark and Greenland, University of California, Irvine, Wuhan University","France, China, United States, United Arab Emirates, Germany, Hong Kong, United Kingdom, Denmark"
127,10.3389/feart.2020.00370,Investigating Controls on the Formation and Distribution of Wintertime Storage of Water in Supraglacial Lakes,Journal,Frontiers in Earth Science,2020-11-27,3.0,2.5,"Derrick Julius Lampkin, Lora Koenig, Casey Joseph, Jason Eric Box",False,Jason E. Box,"male, female, male, male",male,male,male,1.0,3.0,0.0,"Geological Survey of Denmark and Greenland, University of Colorado Boulder, University of Maryland, College Park","United States, Denmark"
128,10.5194/tc-14-3935-2020,GrSMBMIP: Intercomparison of the modelled 1980-2012 surface mass balance over the Greenland Ice Sheet,Journal,Cryosphere,2020-11-11,28.0,81.45,"Xavier Fettweis, Stefan Hofer, Uta Krebs-Kanzow, Charles Amory, Teruo Aoki, Constantijn J. Berends, Andreas Born, Jason E. Box, Alison Delhasse, Koji Fujita, Paul Gierz, Heiko Goelzer, Edward Hanna, Akihiro Hashimoto, Philippe Huybrechts, Marie Luise Kapsch, Michalea D. King, Christoph Kittel, Charlotte Lang, Peter L. Langen, Jan T.M. Lenaerts, Glen E. Liston, Gerrit Lohmann, Sebastian H. Mernild, Uwe Mikolajewicz, Kameswarrao Modali, Ruth H. Mottram, Masashi Niwano, Brice Noël, Jonathan C. Ryan, Amy Smith, Jan Streffing, Marco Tedesco, Willem Jan Van De Berg, Michiel Van Den Broeke, Roderik S.W. Van De Wal, Leo Van Kampenhout, David Wilton, Bert Wouters, Florian Ziemen, Tobias Zolles",False,Jason E. Box,"male, male, female, male, male, male, male, male, female, male, male, male, male, male, male, female, female, male, female, male, male, male, male, male, male, male, female, male, male, male, female, male, male, male, male, male, male, male, male, male, male",male,male,male,7.0,34.0,0.0,"Universiteit Utrecht, Syddansk Universitet, Institute for Marine and Atmospheric Research, Utrecht, Université de Liège, Nagoya University, National Institute of Polar Research, Byrd Polar and Climate Research Center, Brown University, Nansen Environmental and Remote Sensing Center, Universidad de Magallanes, Universitetet i Oslo, Alfred-Wegener-Institut Helmholtz-Zentrum für Polar- und Meeresforschung, Danmarks Meteorologiske Institut,  Remote Sensing, TU Delft, Universität Hamburg, Max Planck Institute for Meteorology, University of Colorado Boulder, Japan Meteorological Agency, Aarhus Universitet, Université Libre de Bruxelles, Vrije Universiteit Brussel, Colorado State University, Department of Geoscience &amp, Bjerknes Centre for Climate Research, School of Geography and Lincoln Centre for Water and Planetary Health, Universitetet i Bergen, Geological Survey of Denmark and Greenland, Lamont-Doherty Earth Observatory, Western Norway University of Applied Sciences, The University of Sheffield","United States, Norway, Chile, Belgium, Japan, Germany, United Kingdom, Denmark, Netherlands"
129,10.5194/tc-14-3785-2020,The firn meltwater Retention Model Intercomparison Project (RetMIP): Evaluation of nine firn models at four weather station sites on the Greenland ice sheet,Journal,Cryosphere,2020-11-06,8.0,6.95,"Baptiste Vandecrux, Ruth Mottram, Peter L. Langen, Robert S. Fausto, Martin Olesen, C. Max Stevens, Vincent Verjans, Amber Leeson, Stefan Ligtenberg, Peter Kuipers Munneke, Sergey Marchenko, Ward Van Pelt, Colin R. Meyer, Sebastian B. Simonsen, Achim Heilig, Samira Samimi, Shawn Marshall, Horst MacHguth, Michael MacFerrin, Masashi Niwano, Olivia Miller, Clifford I. Voss, Jason E. Box",True,"Robert Schjøtt Fausto, Baptiste Vandecrux, Jason E. Box","male, female, male, male, male, male, male, female, male, male, male, male, male, male, male, female, male, male, male, male, female, male, male","male, male, male",male,male,4.0,19.0,0.0,"United States Geological Survey Western Region, Uppsala Universitet, Weather Impact, University of Calgary, Institute for Marine and Atmospheric Research, Utrecht, Ludwig-Maximilians-Universität München, University of Colorado Boulder, Danmarks Meteorologiske Institut, Japan Meteorological Agency, Technical University of Denmark, Aarhus Universitet, Lancaster Environment Centre, Geological Survey of Denmark and Greenland, Thayer School of Engineering at Dartmouth, University of Fribourg, University of Washington, United States Geological Survey","Sweden, United States, Switzerland, Japan, Germany, Canada, United Kingdom, Denmark, Netherlands"
130,10.3389/feart.2020.00292,"Mountain Temperature Changes From Embedded Sensors Spanning 2000 m in Great Basin National Park, 2006–2018",Journal,Frontiers in Earth Science,2020-07-14,1.0,4.8,"Emily N. Sambuco, Bryan G. Mark, Nathan Patrick, James Q. DeGrand, David F. Porinchu, Scott A. Reinemann, Gretchen M. Baker, Jason E. Box",False,Jason E. Box,"female, male, male, male, male, male, female, male",male,female,male,2.0,6.0,0.0,"Sinclair Community College, University of Georgia, National Oceanic and Atmospheric Administration, The Ohio State University, Geological Survey of Denmark and Greenland (GEUS), US National Park Service",United States
131,10.1017/jog.2020.30,Firn cold content evolution at nine sites on the Greenland ice sheet between 1998 and 2017,Journal,Journal of Glaciology,2020-01-01,7.0,17.28,"B. Vandecrux, R. S. Fausto, D. Van As, W. Colgan, P. L. Langen, K. Haubner, T. Ingeman-Nielsen, A. Heilig, C. M. Stevens, M. MacFerrin, M. Niwano, K. Steffen, J. E. Box",True,"William Colgan, Robert Schjøtt Fausto, Baptiste Vandecrux, Jason E. Box","male, male, male, male, male, female, male, male, male, male, male, male, male","male, male, male, male",male,male,1.0,12.0,0.0,"Ludwig-Maximilians-Universität München, University of Colorado Boulder, Danmarks Meteorologiske Institut, Eidgenössische Forschungsanstalt für Wald, Schnee und Landschaft WSL, Japan Meteorological Agency, Technical University of Denmark, Université Libre de Bruxelles, Geological Survey of Denmark and Greenland, University of Washington","United States, Belgium, Switzerland, Japan, Germany, Denmark"
132,10.3390/rs12020234,The determination of snow albedo from satellite measurements using fast atmospheric correction technique,Journal,Remote Sensing,2020-01-01,6.0,18.25,"Alexander Kokhanovsky, Jason E. Box, Baptiste Vandecrux, Kenneth D. Mankoff, Maxim Lamare, Alexander Smirnov, Michael Kern",False,"Baptiste Vandecrux, Kenneth David Mankoff, Jason E. Box","male, male, male, male, male, male, male","male, male, male",male,male,0.0,7.0,0.0,"VITROCISET, NASA Goddard Space Flight Center, Science Systems and Applications, Inc. (SSAI), CNRM Centre National de Recherches Météorologiques, Geological Survey of Denmark and Greenland, ESTEC - European Space Research and Technology Centre","France, United States, Germany, Denmark, Netherlands"
133,10.3390/rs11192280,Retrieval of snow properties from the Sentinel-3 Ocean and Land Colour Instrument,Journal,Remote Sensing,2019-10-01,20.0,17.9,"Alexander Kokhanovsky, Maxim Lamare, Olaf Danne, Carsten Brockmann, Marie Dumont, Ghislain Picard, Laurent Arnaud, Vincent Favier, Bruno Jourdain, Emmanuel Le Meur, Biagio Di Mauro, Teruo Aoki, Masashi Niwano, Vladimir Rozanov, Sergey Korkin, Sepp Kipfstuhl, Johannes Freitag, Maria Hoerhold, Alexandra Zuhr, Diana Vladimirova, Anne Katrine Faber, Hans Christian Steen-Larsen, Sonja Wahl, Jonas K. Andersen, Baptiste Vandecrux, Dirk van As, Kenneth D. Mankoff, Michael Kern, Eleonora Zege, Jason E. Box",False,"Kenneth David Mankoff, Baptiste Vandecrux, Jason E. Box","male, male, male, male, female, male, male, male, male, male, male, male, male, male, male, male, male, female, female, female, female, male, female, male, male, male, male, male, female, male","male, male, male",male,male,7.0,23.0,0.0,"Università degli Studi di Milano-Bicocca, Universitetet i Bergen, Universität Potsdam, Alfred-Wegener-Institut Helmholtz-Zentrum für Polar- und Meeresforschung, Københavns Universitet, Japan Meteorological Agency, CNRM Centre National de Recherches Météorologiques, Universities Space Research Association, VITROCISET Belgium SPRL, CNRS Centre National de la Recherche Scientifique, National Institute of Polar Research, Brockmann Consult GmbH, Universität Bremen, Geological Survey of Denmark and Greenland, B. I. Stepanov Institute of Physics, ESTEC - European Space Research and Technology Centre","France, Belarus, United States, Norway, Japan, Germany, Italy, Denmark, Netherlands"
134,10.1016/j.polar.2018.11.008,The urgency of Arctic change,Journal,Polar Science,2019-09-01,60.0,161.18,"James Overland, Edward Dunlea, Jason E. Box, Robert Corell, Martin Forsius, Vladimir Kattsov, Morten Skovgård Olsen, Janet Pawlak, Lars Otto Reiersen, Muyin Wang",False,Jason E. Box,"male, male, male, male, male, male, male, female, male, male",male,male,male,1.0,9.0,0.0,"NOAA Pacific Marine Environmental Laboratory, Global Environment and Technology Foundation, Voeikov Main Geophysical Observatory, Joint Institute for the Study of the Atmosphere and Ocean, Danish Ministry of Energy, AMAP Secretariat, Geological Survey of Denmark and Greenland, Finnish Environment Institute, UiT The Arctic University of Norway","United States, Norway, Russian Federation, Finland, Denmark"
135,10.34194/GEUSB-201943-01-01,Sea-level rise in Denmark: Bridging local reconstructions and global projections,Book Series,Geological Survey of Denmark and Greenland Bulletin,2019-07-01,0.0,40.65,"William Colgan, Jason E. Box, Sofia Ribeiro, Kristian K. Kjeldsen",True,"Kristian Kjellerup Kjeldsen, William Colgan, Sofia Ribeiro, Jason E. Box","male, male, female, male","male, male, female, male",male,male,1.0,3.0,0.0,Geological Survey of Denmark and Greenland,Denmark
