,doi,title,type,journal,date,citations,altmetric,authors,org_led,org_authors,genders,org_genders,first_gender,last_gender,female_authors,male_authors,nonbinary_authors,affiliations,countries
202,10.1175/2013BAMSStateoftheClimate.1,State of the climate in 2012,Journal,Bulletin of the American Meteorological Society,2013-08-01,68.0,96.01,"Christine Achberger, Stephen A. Ackerman, Adelina Albanil, P. Alexander, Eric J. Alfaro, Rob Allan, Lincoln M. Alves, Jorge A. Amador, Peter Ambenje, Solonomenjanahary Andrianjafinirina, John Antonov, Jose A. Aravequia, A. Arendt, Juan Arévalo, Derek S. Arndt, I. Ashik, Zachary Atheru, Viva Banzon, Molly O. Baringer, Sandra Barreira, David E. Barriopedro, Grant Beard, Andreas Becker, Michael J. Behrenfeld, Gerald D. Bell, Angela Benedetti, Germar Bernhard, Paul Berrisford, David I. Berry, U. Bhatt, Mario Bidegain, Nathan Bindoff, Peter Bissolli, Eric S. Blake, Jessica Blunden, Raj Booneeady, Michael Bosilovich, J. E. Box, Tim Boyer, Geir O. Braathen, David H. Bromwich, R. Brown, L. Brown, Lori Bruhwiler, Olga N. Bulygina, D. Burgess, John Burrows, Blanca Calderón, Suzana J. Camargo, Jayaka Campbell, Y. Cao, J. Cappelen, Gualberto Carrasco, Don P. Chambers, L. Chang'A, Petra Chappell, Wissam Chehade, Muthuvel Cheliah, Hanne H. Christiansen, John R. Christy, Phillipe Ciais, Caio A.S. Coelho, J. G. Cogley, Steve Colwell, J. N. Cross, Jake Crouch, Stuart A. Cunningham, Milan Dacic, Richard A.M. De Jeu, Francis S. Dekaa, Mesut Demircan, C. Derksen, Howard J. Diamond, Ed J. Dlugokencky, Kathleen Dohan, A. Johannes Dolman, Catia M. Domingues, Shenfu Dong, Wouter A. Dorigo, D. S. Drozdov, Claude R. Duguay, Robert J.H. Dunn, Ana M. Dúran-Quesada, Geoff S. Dutton, Christian Ehmann, James W. Elkins, Christian Euscátegui, James S. Famiglietti, Fan Fang, Nicolas Fauchereau, Richard A. Feely, Balázs M. Fekete, Chris Fenimore, Vitali E. Fioletov, Chris T. Fogarty, Ryan L. Fogt, Chris K. Folland, Michael J. Foster, Eleanor Frajka-Williams, Bryan A. Franz",False,Jason E. Box,"female, male, female, male, male, male, male, male, male, male, male, male, male, male, male, male, male, female, female, female, male, male, male, male, male, female, male, male, male, female, male, male, male, male, female, male, male, male, male, male, male, male, male, female, female, male, male, female, female, male, male, male, male, male, male, female, male, male, female, male, male, male, male, male, female, male, male, male, male, male, male, male, male, male, female, male, female, male, male, male, male, male, female, male, male, male, male, male, male, male, male, male, male, male, male, male, male, male, female, male",male,female,male,19.0,81.0,0.0,"NOAA/NESDIS National Climatic Data Center, Instituto de Hidrología de Meteorología y Estudios Ambientales de Colombia (IDEAM), Technische Universität Wien, The University of the West Indies, División de Climatología, Turkish State Meteorological Service, Invasive Animals Cooperative Research Centre and CSIRO Marine and Atmospheric Science, University Corporation for Atmospheric Research, Universidad Complutense de Madrid, Cooperative Institute for Meteorological Satellite Studies, Karlsruher Institut für Technologie, Byrd Polar and Climate Research Center, University of California, Irvine, European Centre for Medium-Range Weather Forecasts, Universidad de Costa Rica, All-Russian Research Institute of Hydrometeorological Information - World Data Center, National Institute of Water and Atmospheric Research, New Zealand, Rosenstiel School of Marine and Atmospheric Science, Nigerian Meteorological Agency, National Oceanic and Atmospheric Administration, University of South Florida St. Petersburg, Universitetet i Oslo, Université de Versailles Saint-Quentin-en-Yvelines, Instituto Nacional de Meteorología e Hidrología de Venezuela (INAMEH), Biospherical Instruments, Danmarks Meteorologiske Institut, Earth and Space Research, Kenya Meteorological Department, Deutscher Wetterdienst, NOAA Atlantic Oceanographic and Meteorological Laboratory, University of Waterloo, World Meteorological Organization, Ohio University, University of Cape Town, Tanzania Meteorological Agency, City College of New York, IGAD Climate Prediction and Applications Centre (ICPAC), Göteborgs Universitet, Environment Canada, University of Alaska Fairbanks, University of Colorado Boulder, Met Office, Republic Hydrometeorological Service of Serbia, The University of Alabama in Huntsville, Geological Survey of Canada, Scottish Marine Institute Oban, Institute of the Earth Cryosphere of the Siberian Branch of the RAS, British Antarctic Survey, Bureau of Meteorology Australia, NASA Goddard Space Flight Center, The University Centre in Svalbard, Ocean University of China, Servicio Nacional de Meteorología e Hidrología, National Meteorological Service of, National Hurricane Center, Geological Survey of Denmark and Greenland, Oregon State University, National Oceanography Centre Southampton, Antarctic Climate and Ecosystems Cooperative Research Centre, Vrije Universiteit Amsterdam, Arctic and Antarctic Research Institute, Universität Bremen, Trent University, Lamont-Doherty Earth Observatory, Instituto Nacional de Pesquisas Espaciais, Argentine Naval Hydrographic Service","China, Uruguay, Jamaica, Switzerland, Argentina, Russian Federation, Germany, Mexico, France, Sweden, Brazil, Tanzania, Kenya, Spain, Norway, Colombia, Canada, Nigeria, Denmark, South Africa, Australia, Costa Rica, Serbia, United States, Bolivia, Austria, Turkey, Venezuela, United Kingdom, Netherlands, New Zealand"
203,10.5194/cp-9-583-2013,On the origin of multidecadal to centennial Greenland temperature anomalies over the past 800 yr,Journal,Climate of the Past,2013-07-15,21.0,11.616,"T. Kobashi, D. T. Shindell, K. Kodera, J. E. Box, T. Nakaegawa, K. Kawamura",False,Jason E. Box,"male, male, male, male, male, male",male,male,male,0.0,6.0,0.0,"Meteorological Research Institute, Scripps Institution of Oceanography, NASA Goddard Institute for Space Studies, The Ohio State University, Nagoya University, National Institute of Polar Research, Byrd Polar and Climate Research Center","Japan, United States"
204,10.3189/2013AoG63A358,Southeast Greenland high accumulation rates derived from firn cores and ground-penetrating radar,Journal,Annals of Glaciology,2013-07-01,38.0,,"Clément Miège, Richard R. Forster, Jason E. Box, Evan W. Burgess, Joseph R. Mcconnell, Daniel R. Pasteris, Vandy B. Spikes",False,Jason E. Box,"male, male, male, male, male, male, male",male,male,male,0.0,7.0,0.0,"Earth Science Agency, LLC, Desert Research Institute, The Ohio State University, Byrd Polar and Climate Research Center, The University of Utah",United States
205,10.1175/JCLI-D-12-00319.1,Twentieth-century global-mean sea level rise: Is the whole greater than the sum of the parts?,Journal,Journal of Climate,2013-07-01,143.0,91.166,"J. M. Gregory, N. J. White, J. A. Church, M. F.P. Bierkens, J. E. Box, M. R. Van Den Broeke, J. G. Cogley, X. Fettweis, E. Hanna, P. Huybrechts, L. F. Konikow, P. W. Leclercq, B. Marzeion, J. Oerlemans, M. E. Tamisiea, Y. Wada, L. M. Wake, R. S.W. Van De Wal",False,Jason E. Box,"male, male, male, male, male, male, male, male, male, male, male, male, male, male, male, male, male, male",male,male,male,0.0,18.0,0.0,"The University of Sheffield, Universiteit Utrecht, University of Calgary, Institute for Marine and Atmospheric Research, Utrecht, CSIRO Marine and Atmospheric Research, Deltares, Universität Innsbruck, Université de Liège, National Oceanography Centre, University of Reading, Trent University, Vrije Universiteit Brussel, Byrd Polar and Climate Research Center, United States Geological Survey","United States, Austria, Belgium, Canada, United Kingdom, Netherlands, Australia"
206,10.1002/jgrf.20062,Decadal-scale sensitivity of Northeast Greenland ice flow to errors in surface mass balance using ISSM,Journal,Journal of Geophysical Research: Earth Surface,2013-06-01,15.0,3.2,"N. J. Schlegel, E. Larour, H. Seroussi, M. Morlighem, J. E. Box",False,Jason E. Box,"female, male, male, male, male",male,female,male,1.0,4.0,0.0,"University of California, Irvine, Byrd Polar and Climate Research Center, Jet Propulsion Laboratory",United States
207,10.1175/JCLI-D-12-00373.1,Greenland ice sheet mass balance reconstruction. Part I: Net snow accumulation (1600-2009),Journal,Journal of Climate,2013-06-01,43.0,73.174,"Jason E. Box, Noel Cressie, David H. Bromwich, Ji Hoon Jung, Michiel Van Den Broeke, J. H. Van Angelen, Richard R. Forster, Clement Miège, Ellen Mosley-Thompson, BO Vinther, Joseph R. Mcconnell",True,Jason E. Box,"male, male, male, male, male, male, male, male, female, male, male",male,male,male,1.0,10.0,0.0,"Institute for Marine and Atmospheric Research, Utrecht, Niels Bohr Institutet, Desert Research Institute, The Ohio State University, University of Wollongong, Byrd Polar and Climate Research Center, The University of Utah","United States, Denmark, Netherlands, Australia"
208,10.1002/grl.50240,Variability in the surface temperature and melt extent of the Greenland ice sheet from MODIS,Journal,Geophysical Research Letters,2013-05-28,95.0,8.5,"Dorothy K. Hall, Josefino C. Comiso, Nicolo E. Digirolamo, Christopher A. Shuman, Jason E. Box, Lora S. Koenig",False,Jason E. Box,"female, male, male, male, male, female",male,female,female,2.0,4.0,0.0,"Byrd Polar and Climate Research Center, Science Systems and Applications, Inc. (SSAI), University of Maryland, Baltimore County (UMBC), NASA Goddard Space Flight Center",United States
209,10.1002/2013EO100006,Improving surface mass balance over ice sheets and snow depth on sea ice,Journal,Eos,2013-03-05,4.0,,"Lora Koenig, Jason Box, Nathan Kurtz",False,Jason E. Box,"female, male, male",male,female,male,1.0,2.0,0.0,"Byrd Polar and Climate Research Center, NASA Goddard Space Flight Center",United States
210,10.5194/tc-7-129-2013,Ice tectonic deformation during the rapid in situ drainage of a supraglacial lake on the Greenland Ice Sheet,Journal,Cryosphere,2013-02-18,70.0,8.616,"S. H. Doyle, A. L. Hubbard, C. F. Dow, G. A. Jones, A. Fitzpatrick, A. Gusmeroli, B. Kulessa, K. Lindback, R. Pettersson, J. E. Box",False,Jason E. Box,"male, male, female, male, male, male, male, female, male, male",male,male,male,2.0,8.0,0.0,"Uppsala Universitet, University of Alaska Fairbanks, Aberystwyth University, The Ohio State University, Swansea University","Sweden, United Kingdom, United States"
211,10.1175/JCLI-D-12-00518.1,Greenland ice sheet mass balance reconstruction. Part II: Surface mass balance (1840-2010),Journal,Journal of Climate,2013-01-01,82.0,8.6,Jason E. Box,True,Jason E. Box,male,male,male,,0.0,1.0,0.0,Byrd Polar and Climate Research Center,United States
212,10.3189/2012AoG60A083,Oceanic mechanical forcing of a marine-terminating greenland glacier,Journal,Annals of Glaciology,2012-11-01,58.0,,"Jacob I. Walter, Jason E. Box, Slawek Tulaczyk, Emily E. Brodsky, Ian M. Howat, Yushin Ahn, Abel Brown",False,Jason E. Box,"male, male, male, female, male, male, male",male,male,male,1.0,6.0,0.0,"Byrd Polar and Climate Research Center, Michigan Technological University, University of California, Santa Cruz",United States
213,10.5194/tc-6-821-2012,Greenland ice sheet albedo feedback: Thermodynamics and atmospheric drivers,Journal,Cryosphere,2012-08-24,252.0,63.16,"J. E. Box, X. Fettweis, J. C. Stroeve, M. Tedesco, D. K. Hall, K. Steffen",True,Jason E. Box,"male, male, female, male, female, male",male,male,male,2.0,4.0,0.0,"NASA Goddard Space Flight Center, City University of New York, University of Colorado Boulder, National Snow and Ice Data Center, Université de Liège, The Ohio State University, Byrd Polar and Climate Research Center","United States, Belgium"
214,10.1073/pnas.1204664109,"Bedrock displacements in Greenland manifest ice mass variations, climate cycles and climate change",Journal,Proceedings of the National Academy of Sciences of the United States of America,2012-07-24,86.0,34.416,"Michael Bevis, John Wahr, Shfaqat A. Khan, Finn Bo Madsen, Abel Brown, Michael Willis, Eric Kendrick, Per Knudsen, Jason E. Box, Tonie Van Dam, Dana J. Caccamise, Bjorn Johns, Thomas Nylen, Robin Abbott, Seth White, Jeremy Miner, Rene Forsberg, Hao Zhou, Jian Wang, Terry Wilson, David Bromwich, Olivier Francis",False,Jason E. Box,"male, male, male, male, male, male, male, male, male, male, female, male, male, male, male, male, male, male, male, male, male, male",male,male,male,1.0,21.0,0.0,"Cornell University, UNAVCO Inc., University of Colorado Boulder, The Ohio State University, Technical University of Denmark, Polar Field Services, University of Luxembourg","Luxembourg, United States, Denmark"
215,10.5194/essd-4-1-2012,"Proglacial river stage, discharge, and temperature datasets from the Akuliarusiarsuup Kuua River northern tributary, Southwest Greenland, 2008-2011",Journal,Earth System Science Data,2012-05-12,24.0,,"A. K. Rennermalm, L. C. Smith, V. W. Chu, R. R. Forster, J. E. Box, B. Hagedorn",False,Jason E. Box,"male, female, female, male, male, male",male,male,male,2.0,4.0,0.0,"University of Alaska Anchorage, The Ohio State University, Rutgers University–New Brunswick, University of California, Los Angeles, The University of Utah",United States
216,10.5194/tc-6-1-2012,Hydrologic controls on coastal suspended sediment plumes around the Greenland Ice Sheet,Journal,Cryosphere,2012-01-12,31.0,4.5,"V. W. Chu, L. C. Smith, A. K. Rennermalm, R. R. Forster, J. E. Box",False,Jason E. Box,"female, female, male, male, male",male,female,male,2.0,3.0,0.0,"The Ohio State University, Rutgers University–New Brunswick, University of California, Los Angeles, Byrd Polar and Climate Research Center, The University of Utah",United States
217,10.3189/172756411799096312,Greenland marine-terminating glacier area changes: 2000-2010,Journal,Annals of Glaciology,2011-12-01,43.0,3.25,"Jason E. Box, David T. Decker",True,Jason E. Box,"male, male",male,male,male,0.0,2.0,0.0,"Byrd Polar and Climate Research Center, The Ohio State University",United States
218,,Climate change in Great Basin National Park: Lake sediment and sensor-based studies,Journal,Park Science,2011-11-09,4.0,,"Scott A. Reinemann, Nathan A. Patrick, Gretchen M. Baker, David F. Porinchu, Bryan G. Mark, Jason E. Box",False,Jason E. Box,"male, male, female, male, male, male",male,male,male,1.0,5.0,0.0,"University of Georgia, Great Basin National Park, The Ohio State University",United States
219,10.1029/2011GL049444,High variability of Greenland surface temperature over the past 4000 years estimated from trapped air in an ice core,Journal,Geophysical Research Letters,2011-11-01,93.0,169.06,"Takuro Kobashi, Kenji Kawamura, Jeffrey P. Severinghaus, Jean Marc Barnola, Toshiyuki Nakaegawa, Bo M. Vinther, Sigfús J. Johnsen, Jason E. Box",False,Jason E. Box,"male, male, male, male, male, male, male, male",male,male,male,0.0,8.0,0.0,"Scripps Institution of Oceanography, Japan Meteorological Agency, Niels Bohr Institutet, CNRS Centre National de la Recherche Scientifique, National Institute of Polar Research, Byrd Polar and Climate Research Center","France, United States, Denmark, Japan"
220,10.1029/2011EO140001,Context for the recent massive petermann glacier calving event,Journal,Eos,2011-04-27,23.0,23.048,"Kelly K. Falkner, Humfrey Melling, Andreas M. Mnchow, Jason E. Box, Trudy Wohlleben, Helen L. Johnson, Preben Gudmandsen, Roger Samelson, Luke Copland, Konrad Steffen, Eric Rignot, Anthony K. Higgins",False,Jason E. Box,"female, male, male, male, female, female, male, male, male, male, male, male",male,female,male,3.0,9.0,0.0,"Cooperative Institute for Research in Environmental Sciences, Fisheries and Oceans Canada, Jet Propulsion Laboratory, Environment Canada, Oregon State University, College of Earth, Ocean and Environment, University of Ottawa, Technical University of Denmark, Geological Survey of Denmark and Greenland, Byrd Polar and Climate Research Center, University of Oxford","Canada, United Kingdom, Denmark, United States"
221,10.1088/1748-9326/6/1/014005,The role of albedo and accumulation in the 2010 melting record in Greenland,Journal,Environmental Research Letters,2011-01-01,165.0,48.968,"M. Tedesco, X. Fettweis, M. R. Van Den Broeke, R. S.W. Van De Wal, C. J.P.P. Smeets, W. J. Van De Berg, M. C. Serreze, J. E. Box",False,Jason E. Box,"male, male, male, male, male, male, male, male",male,male,male,0.0,8.0,0.0,"City College of New York, Institute for Marine and Atmospheric Research, Utrecht, National Snow and Ice Data Center, Université de Liège, The Ohio State University, Byrd Polar and Climate Research Center","United States, Belgium, Netherlands"
222,10.5194/tc-4-511-2010,Climate of the Greenland ice sheet using a high-resolution climate model - Part 1: Evaluation,Journal,Cryosphere,2010-12-13,110.0,,"J. Ettema, M. R. Van Den Broeke, E. Van Meijgaard, W. J. Van De Berg, J. E. Box, K. Steffen",False,Jason E. Box,"male, male, male, male, male, male",male,male,male,0.0,6.0,0.0,"Faculty of Geo-Information Science and Earth Observation – ITC, Institute for Marine and Atmospheric Research, Utrecht, University of Colorado Boulder, Royal Netherlands Meteorological Institute, Byrd Polar and Climate Research Center","United States, Netherlands"
223,10.3189/002214310793146232,Seasonal variability in the dynamics of marine-terminating outlet glaciers in Greenland,Journal,Journal of Glaciology,2010-10-01,147.0,,"Ian M. Howat, Jason E. Box, Yushin Ahn, Adam Herrington, Ellyn M. McFadden",False,Jason E. Box,"male, male, male, male, female",male,male,female,1.0,4.0,0.0,"Byrd Polar and Climate Research Center, The Ohio State University",United States
224,10.3189/002214310793146313,Instruments and Methods Glacier velocities from time-lapse photos: Technique development and first results from the Extreme Ice Survey (EIS) in Greenland,Journal,Journal of Glaciology,2010-10-01,42.0,,"Yushin Ahn, Jason E. Box",False,Jason E. Box,"male, male",male,male,male,0.0,2.0,0.0,"Byrd Polar and Climate Research Center, The Ohio State University",United States
225,10.1016/j.quaint.2009.07.021,"Application of a midge-based inference model for air temperature reveals evidence of late-20th century warming in sub-alpine lakes in the central Great Basin, United States",Journal,Quaternary International,2010-03-15,12.0,,"David F. Porinchu, Scott Reinemann, Bryan G. Mark, Jason E. Box, Nicolas Rolland",False,Jason E. Box,"male, male, male, male, male",male,male,male,0.0,5.0,0.0,"Université Laval, The Ohio State University","Canada, United States"
226,,Greenland,Book,Changes in the Arctic: Background and Issues,2010-01-01,0.0,,"J. E. Box, L. S. Bai, R. Benson, I. Bhattacharya, D. H. Bromwich, J. Cappelen, D. Decker, N. DiGirolamo, X. Fettweis, D. Hall, E. Hanna, T. Mote, M. Tedesco, R. Van De Wal, M. Van Den Broeke",True,Jason E. Box,"male, male, male, male, male, male, male, male, male, female, male, male, male, male, male",male,male,male,1.0,14.0,0.0,"City College of New York, NASA Goddard Space Flight Center, University of Georgia, Institute for Marine and Atmospheric Research, Utrecht, Danmarks Meteorologiske Institut, Université de Liège, Byrd Polar and Climate Research Center, The University of Sheffield","United States, Belgium, United Kingdom, Denmark, Netherlands"
227,10.1029/2009JF001293,A spatially calibrated model of annual accumulation rate on the Greenland Ice Sheet (1958-2007),Journal,Journal of Geophysical Research: Earth Surface,2010-01-01,98.0,,"Evan W. Burgess, Richard R. Forster, Jason E. Box, Ellen Mosley-Thompson, David H. Bromwich, Roger C. Bales, Laurence C. Smith",False,Jason E. Box,"male, male, male, female, male, male, female",male,male,female,2.0,5.0,0.0,"UC Merced, The Ohio State University, University of California, Los Angeles, Byrd Polar and Climate Research Center, The University of Utah",United States
228,10.3189/002214309790794904,Sediment plume response to surface melting and supraglacial lake drainages on the Greenland ice sheet,Journal,Journal of Glaciology,2009-12-01,49.0,0.5,"Vena W. Chu, Laurence C. Smith, Asa K. Rennermalm, Richard R. Forster, Jason E. Box, Niels Reeh",False,Jason E. Box,"female, female, male, male, male, male",male,female,male,2.0,4.0,0.0,"University of California, Los Angeles, Technical University of Denmark, The Ohio State University, The University of Utah","United States, Denmark"
229,10.1016/j.yqres.2009.06.003,"A multi-proxy paleolimnological reconstruction of Holocene climate conditions in the Great Basin, United States",Journal,Quaternary Research,2009-11-01,36.0,,"Scott A. Reinemann, David F. Porinchu, Amy M. Bloom, Bryan G. Mark, Jason E. Box",False,Jason E. Box,"male, male, female, male, male",male,male,male,1.0,4.0,0.0,"Illinois State University, The Ohio State University",United States
230,10.1175/2009JCLI2816.1,Greenland ice sheet surface air temperature variability: 1840-2007,Journal,Journal of Climate,2009-07-01,115.0,212.332,"Jason E. Box, Lei Yang, David H. Bromwich, Le Sheng Bai",True,Jason E. Box,"male, male, male, male",male,male,male,0.0,4.0,0.0,"South China Seas Institute of Oceanography Chinese Academy of Sciences, Byrd Polar and Climate Research Center","China, United States"
231,10.1029/2009GL038110,Higher surface mass balance of the Greenland ice sheet revealed by high-resolution climate modeling,Journal,Geophysical Research Letters,2009-06-01,348.0,15.044,"Janneke Ettema, Michiel R. Van Den Broeke, Erik Van Meijgaard, Willem Jan Van De Berg, Jonathan L. Bamber, Jason E. Box, Roger C. Bales",False,Jason E. Box,"female, male, male, male, male, male, male",male,female,male,1.0,6.0,0.0,"Institute for Marine and Atmospheric Research, Utrecht, UC Merced, University of Bristol, Royal Netherlands Meteorological Institute, Byrd Polar and Climate Research Center","United Kingdom, Netherlands, United States"
232,10.3189/172756409787769636,Surface mass-balance changes of the Greenland ice sheet since 1866,Journal,Annals of Glaciology,2009-04-20,33.0,3.0,"L. M. Wake, P. Huybrechts, J. E. Box, E. Hanna, I. Janssens, G. A. Milne",False,Jason E. Box,"male, male, male, male, male, male",male,male,male,0.0,6.0,0.0,"Durham University, Alfred-Wegener-Institut Helmholtz-Zentrum für Polar- und Meeresforschung, The Ohio State University, Vrije Universiteit Brussel, Byrd Polar and Climate Research Center, The University of Sheffield","United States, Belgium, Germany, United Kingdom"
233,10.1029/2008GL035417,Mass balance of the Greenland ice sheet from 1958 to 2007,Journal,Geophysical Research Letters,2008-10-28,289.0,33.848,"E. Rignot, J. E. Box, E. Burgess, E. Hanna",False,Jason E. Box,"male, male, male, male",male,male,male,0.0,4.0,0.0,"Jet Propulsion Laboratory, Byrd Polar and Climate Research Center, The University of Utah, University of California, Irvine, The University of Sheffield","United States, United Kingdom"
234,10.1016/j.rse.2008.05.007,Comparison of satellite-derived and in-situ observations of ice and snow surface temperatures over Greenland,Journal,Remote Sensing of Environment,2008-10-15,78.0,8.544,"Dorothy K. Hall, Jason E. Box, Kimberly A. Casey, Simon J. Hook, Christopher A. Shuman, Konrad Steffen",False,Jason E. Box,"female, male, female, male, male, male",male,female,male,2.0,4.0,0.0,"NASA Goddard Space Flight Center, Jet Propulsion Laboratory, University of Maryland, Baltimore County (UMBC), Wyle IS, University of Colorado Boulder, The Ohio State University",United States
235,,Measurements of central Ohio shortwave cloud radiative effect: Assessment of solar power potential,Conference Proceeding,"American Solar Energy Society - Solar 2007: 36th ASES Annual Conf., 32nd National Passive Solar Conf., 2nd Renewable Energy Policy and Marketing Conference: Sustainable Energy Puts America to Work",2007-12-01,0.0,,"Jason E. Box, Andrew Van-Loocke, Emily Sautter, James Degrand",True,Jason E. Box,"male, male, female, male",male,male,male,1.0,3.0,0.0,The Ohio State University,United States
236,10.3189/172756507782202883,Remote sounding of Greenland supraglacial melt lakes: Implications for subglacial hydraulics,Journal,Journal of Glaciology,2007-12-01,117.0,,"Jason E. Box, Kathleen Ski",True,Jason E. Box,"male, female",male,male,female,1.0,1.0,0.0,"Byrd Polar and Climate Research Center, The Ohio State University",United States
237,10.1016/j.rse.2006.06.009,Evaluation of the MODIS (MOD10A1) daily snow albedo product over the Greenland ice sheet,Journal,Remote Sensing of Environment,2006-11-30,105.0,,"Julienne C. Stroeve, Jason E. Box, Terry Haran",False,Jason E. Box,"female, male, male",male,female,male,1.0,2.0,0.0,"Byrd Polar and Climate Research Center, University of Colorado Boulder",United States
238,10.1029/2006GL025723,Upper-air temperatures around Greenland: 1964-2005,Journal,Geophysical Research Letters,2006-06-28,31.0,11.544,"Jason E. Box, Ariel E. Cohen",True,Jason E. Box,"male, male",male,male,male,0.0,2.0,0.0,"Byrd Polar and Climate Research Center, The Ohio State University",United States
239,10.1175/JCLI3738.1,Greenland ice sheet surface mass balance variability (1988-2004) from calibrated polar MM5 output,Journal,Journal of Climate,2006-06-15,199.0,,"Jason E. Box, David H. Bromwich, Bruce A. Veenhuis, Le Sheng Bai, Julienne C. Stroeve, Jeffrey C. Rogers, Konrad Steffen, T. Haran, Sheng Hung Wang",True,Jason E. Box,"male, male, male, male, female, male, male, male, male",male,male,male,1.0,8.0,0.0,"Byrd Polar and Climate Research Center, University of Colorado Boulder, The Ohio State University",United States
